{
  "device_id": "Quantinuum-H-Series-inspired",
  "date": "2025-01-14T14:00:00Z",
  "qubit_count": 20,
  "two_qubit_gate_fidelity": 0.99921,
  "single_qubit_gate_fidelity": 0.9996,
  "spam_error": 0.0003,
  "t2_seconds": 12.0,
  "t1_seconds": 600.0,
  "link_idle_seconds": 0.0015,
  "heating_error_per_link": 0.00008,
  "single_qubit_gates_per_round": 4,
  "ms_overrotation_rad": 0.00008,
  "crosstalk_error": 0.0002,
  "attacker_storage_seconds": 0.18,
  "notes": "Synthetic data inspired by Quantinuum H-series performance (2025). High-fidelity trapped-ion qubits with cryogenic control. Clearly labelled synthetic for demonstration purposes only."
}
